{"schema":"https://diffra.dev/schemas/delta-v1.schema.json","id":"sha256:b25cc925c47841be053cf744a44b393f30eedc505920c7f4678414a8b9901a88","status":"changed","typeResolution":"recognized","baselineId":"sha256:958abd08efdf8e0f48edf97262f98998a59bad0ac53d5b361553c899f632fb69","candidateEvidenceId":"sha256:a3f28927625197ae2e70d5c3934944aeaf0a5ae55e8a4b1501aeaaa14864438f","comparator":{"id":"diffra.structured-numeric","version":"1.0.0","configDigest":"sha256:44136fa355b3678a1146ad16f7e8649e94fb4fc21fe77e8310c060f61caaff8a","inputTypeId":"org.example.metrics","inputTypeVersion":"1.0"},"changes":[{"path":"/complexity","kind":"modified","value":{"before":"4","after":"5","absolute":"1","relative":"0.25","relativeStatus":"defined"},"unit":"cyclomatic-complexity"}],"provenance":{"baselineEvidenceId":"sha256:e0582f1ced6d0a9c9a88f6e82a03ffa50499c8cc3a0ed6969cc5931806e964f5","candidateEvidenceId":"sha256:a3f28927625197ae2e70d5c3934944aeaf0a5ae55e8a4b1501aeaaa14864438f","environment":{"runtime":"10.0.12"}}}